{
  "$schema": "http://json-schema.org/draft-07/schema#",
  "$id": "https://marketops.local/schemas/docs-as-marketing-input.v1.json",
  "title": "DocsAsMarketingReviewInput",
  "description": "Input contract for the docs_as_marketing_review MCP tool. Mirrors the inputs declared in the docs-as-marketing-review skill.",
  "type": "object",
  "additionalProperties": false,
  "required": [
    "initiative",
    "document_type",
    "source_title",
    "source_url_or_path",
    "target_audience",
    "review_goal",
    "document_text"
  ],
  "properties": {
    "initiative": {
      "type": "string",
      "minLength": 1,
      "description": "Short label for the initiative or product the document belongs to."
    },
    "document_type": {
      "type": "string",
      "enum": [
        "whitepaper",
        "spec",
        "readme",
        "architecture",
        "changelog",
        "proof-pack",
        "canon",
        "other"
      ]
    },
    "source_title": {
      "type": "string",
      "minLength": 1
    },
    "source_url_or_path": {
      "type": "string",
      "minLength": 1,
      "description": "Caller-supplied locator. May be a URL, a repo-relative path, or any stable identifier the caller can resolve."
    },
    "target_audience": {
      "type": "array",
      "minItems": 1,
      "items": { "type": "string", "minLength": 1 }
    },
    "review_goal": {
      "type": "string",
      "minLength": 1
    },
    "document_text": {
      "type": "string",
      "minLength": 1,
      "description": "Verbatim text of the source. Treated as authoritative; the reviewer must not import facts from outside this field."
    },
    "output_mode": {
      "type": "string",
      "enum": ["json", "markdown"],
      "default": "json",
      "description": "Reserved. The MCP tool currently always returns JSON."
    }
  }
}
